{
  "id": "jalon-triceps",
  "grupo_id": "extension-codo",
  "orden": 4,
  "nombre": "Jalón de tríceps en polea",
  "resumen": "De pie frente a la polea alta, el codo se abre hacia abajo con el brazo pegado al costado.",
  "movimiento_id": "jalon-triceps",
  "ejecucion": [
    "De pie frente a la polea, coge la barra con las manos a la anchura de los hombros.",
    "Pega los codos al costado y deja los antebrazos a la altura del pecho.",
    "Estira los codos llevando la barra hacia los muslos.",
    "Vuelve controlando hasta que el antebrazo pase de la horizontal.",
    "El brazo no se mueve: si los codos se van adelante, estás empujando con el pecho."
  ],
  "material": [
    "polea"
  ],
  "nivel": "inicial",
  "musculos": {
    "principal": [
      "triceps"
    ],
    "sinergista": [
      "antebrazo"
    ],
    "estabilizador": [
      "abdomen",
      "dorsal",
      "erectores"
    ]
  },
  "matices": "Con el brazo al costado, la porción larga del tríceps parte acortada y aporta menos que en las versiones con el brazo sobre la cabeza —lo que mide el trabajo citado—. A cambio, es la más fácil de hacer bien y la que mejor permite subir carga poco a poco.",
  "fuentes": [
    {
      "titulo": "Effect of shoulder position on triceps brachii heads activity in dumbbell elbow extension exercises",
      "autor": "J Sports Med Phys Fitness, 2018",
      "url": "https://pubmed.ncbi.nlm.nih.gov/28677940/"
    },
    {
      "titulo": "Essentials of Strength Training and Conditioning (4.ª ed.)",
      "autor": "National Strength and Conditioning Association"
    }
  ]
}
