{
  "id": "bicho-muerto",
  "grupo_id": "core",
  "orden": 7,
  "nombre": "Dead bug",
  "resumen": "Lying face up with arms and legs in the air, you extend one arm and the opposite leg at the same time without the lower back lifting off the floor. It resembles the bird dog, but face up: here the work falls on the abs.",
  "ejecucion": [
    "Lie on your back with your arms reaching towards the ceiling and your legs in the air, hips and knees bent at 90 degrees.",
    "Press your lower back into the floor by bracing your abs, and keep it there throughout.",
    "At the same time, reach one arm back overhead and push the opposite leg away from you until both hover a few centimetres above the floor, without touching it.",
    "Return to the start and repeat with the other arm and leg.",
    "If your lower back lifts off the floor as you extend, shorten the range."
  ],
  "material": [
    "ninguno"
  ],
  "nivel": "inicial",
  "musculos": {
    "principal": [
      "abdomen"
    ],
    "sinergista": [
      "oblicuos",
      "flexores_cadera"
    ],
    "estabilizador": [
      "deltoides_anterior",
      "cuadriceps"
    ]
  },
  "matices": "In a study that graded five difficulty levels in several lumbar stabilisation exercises, this one included, in ten healthy men, trunk muscle activity increased with difficulty. A systematic review found the highest internal oblique activity in the exercises it classed as stability exercises, but also little consistency between the studies’ methods.",
  "fuentes": [
    {
      "titulo": "Electromyographic Changes in Trunk Muscles During Graded Lumbar Stabilization Exercises",
      "autor": "Kim et al., PM R, 2016",
      "url": "https://pubmed.ncbi.nlm.nih.gov/27317910/"
    },
    {
      "titulo": "Core Muscle Activity During Physical Fitness Exercises: A Systematic Review",
      "autor": "Oliva-Lozano and Muyor, Int J Environ Res Public Health, 2020",
      "url": "https://doi.org/10.3390/ijerph17124306"
    }
  ]
}
