{
  "id": "rotacion-rusa",
  "grupo_id": "core",
  "orden": 9,
  "nombre": "Rotación rusa",
  "resumen": "Sentado con el tronco echado atrás y los pies en el aire o apoyados, se gira el tronco de un lado a otro. Trabaja los oblicuos, con o sin peso en las manos.",
  "movimiento_id": "rotacion-rusa",
  "ejecucion": [
    "Siéntate con las rodillas dobladas y echa el tronco atrás hasta unos 45 grados, con la espalda recta.",
    "Junta las manos delante del pecho, o sujeta un peso ligero.",
    "Gira el tronco hacia un lado llevando las manos junto a la cadera, y después hacia el otro.",
    "Para hacerlo más difícil, despega los pies del suelo.",
    "Si notas la zona lumbar o no puedes mantener la espalda recta, hazlo sin peso y con los pies apoyados."
  ],
  "material": [
    "ninguno"
  ],
  "nivel": "intermedio",
  "musculos": {
    "principal": [
      "oblicuos",
      "abdomen"
    ],
    "sinergista": [
      "flexores_cadera"
    ],
    "estabilizador": [
      "erectores"
    ]
  },
  "matices": "No hemos encontrado estudios que midan la rotación rusa en sí. El tronco aguanta inclinado atrás mientras gira, y algunos autores desaconsejan cargar esa combinación de flexión y giro; no hay acuerdo. Con molestias lumbares, mejor sin peso o con otro ejercicio de oblicuos, como el press Pallof.",
  "fuentes": [
    {
      "titulo": "Core Muscle Activity During Physical Fitness Exercises: A Systematic Review",
      "autor": "Oliva-Lozano y Muyor, Int J Environ Res Public Health, 2020",
      "url": "https://doi.org/10.3390/ijerph17124306"
    }
  ]
}
