{
  "id": "press-militar",
  "grupo_id": "empuje-vertical",
  "orden": 2,
  "nombre": "Press militar con barra",
  "resumen": "De pie, la barra sube desde los hombros hasta quedar encima de la cabeza. El tronco entero trabaja para no arquearse mientras los hombros empujan.",
  "movimiento_id": "press-militar",
  "ejecucion": [
    "Saca la barra del soporte a la altura del pecho, o llévala ahí desde el suelo si sabes hacerlo: la ficha empieza con la barra ya apoyada en la parte alta del pecho.",
    "De pie, con las manos algo más abiertas que los hombros y los codos por delante de la barra.",
    "Aprieta glúteos y abdomen: es lo que evita que la espalda se arquee al empujar.",
    "Mete la barbilla para dejar pasar la barra y empuja hacia arriba en vertical.",
    "En cuanto la barra pasa la frente, vuelve a meter la cabeza debajo: el bloqueo termina con la barra sobre la coronilla, no por delante de la cara.",
    "Baja controlando hasta apoyarla otra vez en el pecho."
  ],
  "material": [
    "barra",
    "rack"
  ],
  "nivel": "intermedio",
  "musculos": {
    "principal": [
      "deltoides_anterior",
      "deltoides_lateral",
      "triceps"
    ],
    "sinergista": [
      "trapecio_superior",
      "serrato"
    ],
    "estabilizador": [
      "abdomen",
      "erectores",
      "gluteo_mayor"
    ]
  },
  "matices": "No hay un \"press militar\" único: por detrás de la nuca sale más deltoides posterior y medio, por delante entra más pectoral, y con barra el cuerpo estabiliza más que en máquina. Lo que trabaja depende de cuál hagas.",
  "fuentes": [
    {
      "titulo": "Front vs Back and Barbell vs Machine Overhead Press: An Electromyographic Analysis and Implications For Resistance Training",
      "autor": "Coratella, Tornatore, Longo, Esposito y Cè, Front Physiol, 2022",
      "url": "https://www.frontiersin.org/journals/physiology/articles/10.3389/fphys.2022.825880/full"
    },
    {
      "titulo": "Essentials of Strength Training and Conditioning (4.ª ed.)",
      "autor": "National Strength and Conditioning Association"
    }
  ]
}
