{
  "id": "sentadilla-barra",
  "grupo_id": "sentadilla",
  "orden": 2,
  "nombre": "Barbell back squat",
  "resumen": "The bar rests on the traps and the body goes down until the thighs are parallel to the floor. It works quads and glutes while the torso holds the load.",
  "movimiento_id": "sentadilla-barra",
  "ejecucion": [
    "Set the rack at chest height and the safety pins below the depth you plan to reach.",
    "Rest the bar on your traps, never on your neck, and grip it slightly wider than your shoulders.",
    "Stand the bar up and take two steps back, feet shoulder-width apart, toes slightly out.",
    "Send the hips back and bend hips and knees together, knees tracking over the feet.",
    "Go down until the thighs are parallel to the floor, with the weight spread across the whole foot.",
    "Stand up by driving the floor away, without letting the hips rise ahead of the chest.",
    "When you finish, walk forward until the bar meets the rack and let it rest there."
  ],
  "material": [
    "barra",
    "rack"
  ],
  "nivel": "intermedio",
  "musculos": {
    "principal": [
      "cuadriceps",
      "gluteo_mayor"
    ],
    "sinergista": [
      "aductores",
      "soleo"
    ],
    "estabilizador": [
      "erectores",
      "abdomen",
      "isquiotibiales"
    ]
  },
  "matices": "How much more the glutes work the deeper you go is not settled: activation clearly rises from half to parallel squat, and below that the studies disagree.",
  "fuentes": [
    {
      "titulo": "A Biomechanical Review of the Squat Exercise: Implications for Clinical Practice",
      "autor": "Straub and Powers, Int J Sports Phys Ther, 2024",
      "url": "https://ijspt.scholasticahq.com/article/94600-a-biomechanical-review-of-the-squat-exercise-implications-for-clinical-practice"
    },
    {
      "titulo": "Essentials of Strength Training and Conditioning (4th ed.)",
      "autor": "National Strength and Conditioning Association"
    }
  ]
}
