{
  "id": "zancada-mancuernas",
  "grupo_id": "zancada",
  "orden": 1,
  "nombre": "Zancada hacia delante con mancuernas",
  "resumen": "Un paso al frente, se baja hasta que las dos rodillas quedan a 90 grados y se vuelve. Cada pierna trabaja por su cuenta, y el equilibrio entra en el ejercicio.",
  "movimiento_id": "zancada-mancuernas",
  "ejecucion": [
    "De pie, con una mancuerna en cada mano y los brazos relajados a los lados.",
    "Da un paso al frente y baja recto, doblando las dos rodillas hasta unos 90 grados.",
    "La rodilla de delante se queda sobre el pie, y la de atrás baja cerca del suelo sin tocarlo.",
    "Empuja con el pie de delante para volver a la posición inicial, y cambia de pierna."
  ],
  "material": [
    "mancuerna"
  ],
  "nivel": "inicial",
  "musculos": {
    "principal": [
      "cuadriceps",
      "gluteo_mayor"
    ],
    "sinergista": [
      "isquiotibiales",
      "soleo"
    ],
    "estabilizador": [
      "gluteo_medio",
      "abdomen",
      "erectores"
    ]
  },
  "matices": "En ese estudio, los vastos del cuádriceps salen por delante de los glúteos en la zancada, y el glúteo medio aparece sobre todo sosteniendo la cadera más que moviendo la pierna.",
  "fuentes": [
    {
      "titulo": "Electromyographic activity in the gluteus medius, gluteus maximus, biceps femoris, vastus lateralis, vastus medialis and rectus femoris during the Monopodal Squat, Forward Lunge and Lateral Step-Up exercises",
      "autor": "Muyor, Martín-Fuentes, Rodríguez-Ridao y Antequera-Vique, PLOS ONE, 2020",
      "url": "https://journals.plos.org/plosone/article?id=10.1371/journal.pone.0230841"
    },
    {
      "titulo": "Essentials of Strength Training and Conditioning (4.ª ed.)",
      "autor": "National Strength and Conditioning Association"
    }
  ]
}
