{
  "id": "sentadilla-barra",
  "grupo_id": "sentadilla",
  "orden": 1,
  "nombre": "Sentadilla trasera con barra",
  "resumen": "La barra descansa sobre los trapecios y el cuerpo baja hasta que los muslos quedan paralelos al suelo. Trabaja cuádriceps y glúteo mientras el tronco sostiene la carga.",
  "movimiento_id": "sentadilla-barra",
  "ejecucion": [
    "Coloca la barra sobre los trapecios, nunca sobre el cuello, y agárrala algo más abierto que los hombros.",
    "Separa los pies a la anchura de los hombros, con las puntas ligeramente hacia fuera.",
    "Lleva la cadera atrás y baja doblando cadera y rodillas a la vez, con las rodillas siguiendo la línea de los pies.",
    "Baja hasta que los muslos queden paralelos al suelo, manteniendo la barra sobre el medio pie.",
    "Sube empujando el suelo, sin que la cadera adelante al pecho."
  ],
  "material": [
    "barra",
    "rack"
  ],
  "nivel": "intermedio",
  "musculos": {
    "principal": [
      "cuadriceps",
      "gluteo_mayor"
    ],
    "sinergista": [
      "aductores",
      "soleo"
    ],
    "estabilizador": [
      "erectores",
      "abdomen",
      "isquiotibiales"
    ]
  },
  "matices": "Cuánto más trabaja el glúteo cuanto más se baja no está cerrado: la activación sube con claridad de media sentadilla a paralela, y de ahí hacia abajo los estudios se contradicen.",
  "fuentes": [
    {
      "titulo": "A Biomechanical Review of the Squat Exercise: Implications for Clinical Practice",
      "autor": "Straub y Powers, Int J Sports Phys Ther, 2024",
      "url": "https://ijspt.scholasticahq.com/article/94600-a-biomechanical-review-of-the-squat-exercise-implications-for-clinical-practice"
    },
    {
      "titulo": "Essentials of Strength Training and Conditioning (4.ª ed.)",
      "autor": "National Strength and Conditioning Association"
    }
  ]
}
